Class,Module Category,Source,Binding,Status Legend,Python Naming Note,Class Note
PixelFOV,"Spice, Instruments, and Cameras",isis/src/base/objs/PixelFOV/PixelFOV.h,N/A,Y = converted; N = not converted; Partial = partially converted,Converted entries use the current Python name; unconverted entries use the proposed Python name,

Group,C++ Method/Content,Python Class/Function Name,Converted,Notes
Class Symbol,PixelFOV,isis_pybind.PixelFOV,N,Python class symbol not found in current binding files
Construction/Enum,PixelFOV(),isis_pybind.PixelFOV(),N,Constructor binding not detected in current binding files
Public API,"QList< QList<QPointF> > latLonVertices(Camera &camera, const double sample, const double line, const int numIfovs = 1) const",isis_pybind.PixelFOV.lat_lon_vertices,N,Method not found in current binding files
