Class,Module Category,Source,Binding,Status Legend,Python Naming Note,Class Note
PolynomialBivariate,Math,isis/src/base/objs/PolynomialBivariate/PolynomialBivariate.h,N/A,Y = converted; N = not converted; Partial = partially converted,Converted entries use the current Python name; unconverted entries use the proposed Python name,

Group,C++ Method/Content,Python Class/Function Name,Converted,Notes
Class Symbol,PolynomialBivariate,isis_pybind.PolynomialBivariate,Y,Bound in src/base/bind_base_math.cpp as BasisFunction subclass
Construction/Enum,PolynomialBivariate(int degree),isis_pybind.PolynomialBivariate(),Y,Constructor with degree bound
Public API,void Expand(const std::vector<double> &vars),isis_pybind.PolynomialBivariate.expand,Y,Bound as expand
