Class,Module Category,Source,Binding,Status Legend,Python Naming Note,Class Note
NthOrderPolynomial,Math,isis/src/base/objs/NthOrderPolynomial/NthOrderPolynomial.h,N/A,Y = converted; N = not converted; Partial = partially converted,Converted entries use the current Python name; unconverted entries use the proposed Python name,

Group,C++ Method/Content,Python Class/Function Name,Converted,Notes
Class Symbol,NthOrderPolynomial,isis_pybind.NthOrderPolynomial,N,Python class symbol not found in current binding files
Construction/Enum,NthOrderPolynomial(),isis_pybind.NthOrderPolynomial(),N,Constructor binding not detected in current binding files
Public API,void Expand(const std::vector<double> &vars),isis_pybind.NthOrderPolynomial.expand,N,Method not found in current binding files
