Class,Module Category,Source,Binding,Status Legend,Python Naming Note,Class Note
RadarSkyMap,"Spice, Instruments, and Cameras",isis/src/base/objs/RadarSkyMap/RadarSkyMap.h,N/A,Y = converted; N = not converted; Partial = partially converted,Converted entries use the current Python name; unconverted entries use the proposed Python name,

Group,C++ Method/Content,Python Class/Function Name,Converted,Notes
Class Symbol,RadarSkyMap,isis_pybind.RadarSkyMap,N,Python class symbol not found in current binding files
Construction/Enum,RadarSkyMap(),isis_pybind.RadarSkyMap(),N,Constructor binding not detected in current binding files
Mutation/Configuration,"virtual bool SetFocalPlane(const double ux, const double uy, const double uz)",isis_pybind.RadarSkyMap.set_focal_plane,N,Method not found in current binding files
Mutation/Configuration,"virtual bool SetSky(const double ra, const double dec)",isis_pybind.RadarSkyMap.set_sky,N,Method not found in current binding files
