Class,Module Category,Source,Binding,Status Legend,Python Naming Note,Class Note
CubeTileHandler,Low Level Cube I/O,reference/upstream_isis/src/base/objs/Cube/CubeTileHandler.h,src/bind_low_level_cube_io.cpp,Y = converted; N = not converted; Partial = partially converted,Converted entries use the current Python name; unconverted entries use the proposed Python name,2026-04-09 通过安全 QFile-owned wrapper 暴露 Python 可测构造与 update_labels 接口

Group,C++ Method/Content,Python Class/Function Name,Converted,Notes
Class Symbol,CubeTileHandler,isis_pybind.CubeTileHandler,Y,Bound as a safe Python wrapper class that owns QFile and forwards to Isis::CubeTileHandler
Construction/Enum,"CubeTileHandler(const std::string &data_file_path, const Pvl &labels, const std::vector<int> &virtual_bands = {}, bool already_on_disk = false)",isis_pybind.CubeTileHandler(...),Y,Python constructor adapts the upstream QFile* and QList<int>* inputs into safe Python-owned resources
Public API,void updateLabels(Pvl &label),isis_pybind.CubeTileHandler.update_labels,Y,Forwards to the wrapped handler and updates Core.Format to Tile while recording tile dimensions
