Class,Module Category,Source,Binding,Status Legend,Python Naming Note,Class Note
SubArea,High Level Cube I/O,isis/src/base/objs/SubArea/SubArea.h,N/A,Y = converted; N = not converted; Partial = partially converted,Converted entries use the current Python name; unconverted entries use the proposed Python name,

Group,C++ Method/Content,Python Class/Function Name,Converted,Notes
Class Symbol,SubArea,isis_pybind.SubArea,N,Python class symbol not found in current binding files
Construction/Enum,SubArea(),isis_pybind.SubArea(),N,Constructor binding not detected in current binding files
Mutation/Configuration,"void SetSubArea(const int orignl, const int origns, const int sl, const int ss, const int el, const int es, const double linc, const double sinc)",isis_pybind.SubArea.set_sub_area,N,Method not found in current binding files
Public API,"void UpdateLabel(Cube *icube, Cube *ocube, PvlGroup &results)",isis_pybind.SubArea.update_label,N,Method not found in current binding files
