Class,Module Category,Source,Binding,Status Legend,Python Naming Note,Class Note
StripPolygonSeeder,Pattern Matching,isis/src/base/objs/StripPolygonSeeder/StripPolygonSeeder.h,N/A,Y = converted; N = not converted; Partial = partially converted,Converted entries use the current Python name; unconverted entries use the proposed Python name,

Group,C++ Method/Content,Python Class/Function Name,Converted,Notes
Class Symbol,StripPolygonSeeder,isis_pybind.StripPolygonSeeder,N,Python class symbol not found in current binding files
Construction/Enum,StripPolygonSeeder(),isis_pybind.StripPolygonSeeder(),N,Constructor binding not detected in current binding files
Public API,std::vector<geos::geom::Point *> Seed(const geos::geom::MultiPolygon *mp),isis_pybind.StripPolygonSeeder.seed,N,Method not found in current binding files
Public API,virtual PvlGroup PluginParameters(QString grpName),isis_pybind.StripPolygonSeeder.plugin_parameters,N,Method not found in current binding files
