Class,Module Category,Source,Binding,Status Legend,Python Naming Note,Class Note
GaussianStretch,Utility,isis/src/base/objs/GaussianStretch/GaussianStretch.h,N/A,Y = converted; N = not converted; Partial = partially converted,Converted entries use the current Python name; unconverted entries use the proposed Python name,

Group,C++ Method/Content,Python Class/Function Name,Converted,Notes
Class Symbol,GaussianStretch,isis_pybind.GaussianStretch,N,Python class symbol not found in current binding files
Construction/Enum,GaussianStretch(),isis_pybind.GaussianStretch(),N,Constructor binding not detected in current binding files
Public API,double Map(const double value) const,isis_pybind.GaussianStretch.map,N,Method not found in current binding files
