Class,Module Category,Source,Binding,Status Legend,Python Naming Note,Class Note
JP2Exporter,High Level Cube I/O,isis/src/base/objs/JP2Exporter/JP2Exporter.h,N/A,Y = converted; N = not converted; Partial = partially converted,Converted entries use the current Python name; unconverted entries use the proposed Python name,

Group,C++ Method/Content,Python Class/Function Name,Converted,Notes
Class Symbol,JP2Exporter,isis_pybind.JP2Exporter,N,Python class symbol not found in current binding files
Construction/Enum,JP2Exporter(),isis_pybind.JP2Exporter(),N,Constructor binding not detected in current binding files
Read/Write IO,"virtual void write(FileName outputName, int quality=100, QString compression=""none"", UserInterface *ui = nullptr)",isis_pybind.JP2Exporter.write,N,Method not found in current binding files
Static/Factory,static bool canWriteFormat(QString format),isis_pybind.JP2Exporter.can_write_format,N,Method not found in current binding files
