Class,Module Category,Source,Binding,Status Legend,Python Naming Note,Class Note
PvlTokenizer,Parsing,isis/src/base/objs/PvlTokenizer/PvlTokenizer.h,N/A,Y = converted; N = not converted; Partial = partially converted,Converted entries use the current Python name; unconverted entries use the proposed Python name,2026-04-08 第四阶段后端 / 桥接 / 工具类批次 inventory 预登记

Group,C++ Method/Content,Python Class/Function Name,Converted,Notes
Class Symbol,PvlTokenizer,isis_pybind.PvlTokenizer,N,Python class symbol not found in current binding files
Construction/Enum,PvlTokenizer(),isis_pybind.PvlTokenizer(),N,Constructor binding not detected in current binding files
Read/Write IO,"void Load(std::istream &stream, const QString &terminator = ""END"")",isis_pybind.PvlTokenizer.load,N,Method not found in current binding files
Mutation/Configuration,void Clear(),isis_pybind.PvlTokenizer.clear,N,Method not found in current binding files
Public API,std::vector<Isis::PvlToken> & GetTokenList(),isis_pybind.PvlTokenizer.get_token_list,N,Method not found in current binding files
