Class,Module Category,Source,Binding,Status Legend,Python Naming Note,Class Note
ImageHistogram,Statistics,isis/src/base/objs/ImageHistogram/ImageHistogram.h,isis_pybind_standalone/src/bind_statistics.cpp,Y = converted; N = not converted; Partial = partially converted,Converted entries use the current Python name; unconverted entries use the proposed Python name,

Group,C++ Method/Content,Python Class/Function Name,Converted,Notes
Class Symbol,ImageHistogram,isis_pybind.ImageHistogram,Y,Python class symbol is exported
Construction/Enum,ImageHistogram(),isis_pybind.ImageHistogram(),Y,Constructor is explicitly bound
Mutation/Configuration,"virtual void AddData(const double *data, const unsigned int count)",isis_pybind.ImageHistogram.add_data,N,Method not found in current binding files
Mutation/Configuration,virtual void AddData(const double data),isis_pybind.ImageHistogram.add_data,N,Method not found in current binding files
Mutation/Configuration,"virtual void RemoveData(const double *data, const unsigned int count)",isis_pybind.ImageHistogram.remove_data,N,Method not found in current binding files
Public API,"virtual void BinRange(const int index, double &low, double &high) const",isis_pybind.ImageHistogram.bin_range,N,Method not found in current binding files
