Class,Module Category,Source,Binding,Status Legend,Python Naming Note,Class Note
ControlNetDiff,Control Networks,isis/src/control/objs/ControlNetDiff/ControlNetDiff.h,isis_pybind_standalone/src/control/bind_control_core.cpp,Y = converted; N = not converted; Partial = partially converted,Converted entries use the current Python name; unconverted entries use the proposed Python name,

Group,C++ Method/Content,Python Class/Function Name,Converted,Notes
Class Symbol,ControlNetDiff,isis_pybind.ControlNetDiff,Y,Python class symbol is exported
Construction/Enum,ControlNetDiff(),isis_pybind.ControlNetDiff(),Y,Default constructor is explicitly bound
Construction/Enum,explicit ControlNetDiff(Pvl &diffFile),isis_pybind.ControlNetDiff(diff_file),Y,PVL-based constructor is explicitly bound
Mutation/Configuration,void addTolerances(Pvl &diffFile),isis_pybind.ControlNetDiff.add_tolerances,Y,Method is explicitly bound
Public API,"Pvl compare(FileName &net1Name, FileName &net2Name)",isis_pybind.ControlNetDiff.compare,Y,Public compare overload is explicitly bound
