Class,Module Category,Source,Binding,Status Legend,Python Naming Note,Class Note
GainTemperature,Mars Reconnaissance Orbiter,isis/src/mro/objs/HiCal/GainTemperature.h,N/A,Y = converted; N = not converted; Partial = partially converted,Converted entries use the current Python name; unconverted entries use the proposed Python name,

Group,C++ Method/Content,Python Class/Function Name,Converted,Notes
Class Symbol,GainTemperature,isis_pybind.GainTemperature,Y,Exposed in src/bind_mro_hical.cpp via a stable local wrapper with shared data/history helpers because required HiCalConf symbols are not exported by the linked ISIS library
Construction/Enum,"GainTemperature() : Module(""GainTemperature"") { }",isis_pybind.GainTemperature(),Y,Default constructor exposed directly
Construction/Enum,"GainTemperature(const HiCalConf &conf) : Module(""GainTemperature"") { init(conf)",isis_pybind.GainTemperature(label, conf_path),Y,Python-facing wrapper reads the selected profile from conf_path and reproduces the stable temperature-correction behavior without directly linking unavailable HiCalConf symbols
